<?xml version="1.0" encoding="UTF-8"?>
<!-- <?xml-stylesheet type="text/xsl" href="users.xsl"?> -->
<users xmlns="http://www.unioverflow.com" xmlns:xs="http://www.w3.org/2001/XMLSchema-instance" xs:schemaLocation="http://www.unioverflow.com users.xsd">
	<user>
		<email>enrico.rotundo@gmail.com</email>
		<password>admin</password>
	</user>
	<user>
		<email>utente1@gmail.com</email>
		<password>utente1</password>
	</user>
	<user>
		<email>utente2@gmail.com</email>
		<password>utente2</password>
	</user>
	<user>
		<email>utente3@gmail.com</email>
		<password>utente3</password>
	</user>
</users>
