<?xml version="1.0" encoding="UTF-8"?>
<users xmlns:xs="http://www.w3.org/2001/XMLSchema-instance" xs:schemaLocation="http://www.unioverflow.com users.xsd">
	<user>
		<email>enrico.rotundo@studenti.unipd.it</email>
		<password>12345678</password>
	</user>
	<user>
		<email>mario.rossi@studenti.unipd.it</email>
		<password>ciaociao</password>
	</user>
	<user>
		<email>mar.rossi@studenti.unipd.it</email>
		<password>provaprovaprova</password>
	</user>
	<user>
		<email>prova@studenti.unipd.it</email>
		<password>utente3738AkkkaA</password>
	</user>
<user><email>email</email><password>pass</password></user></users>
